{
  "id": "outfit-army",
  "name": "Outfit Army",
  "category": "military",
  "description": "Equip your troops with superior arms, armor, and supplies to enhance their battlefield effectiveness.",
  "skills": [
    {
      "skill": "crafting",
      "description": "forge equipment"
    },
    {
      "skill": "society",
      "description": "requisition supplies"
    },
    {
      "skill": "intimidation",
      "description": "commandeer resources"
    },
    {
      "skill": "thievery",
      "description": "acquire through subterfuge"
    },
    {
      "skill": "warfare-lore",
      "description": "military procurement"
    }
  ],
  "effects": {
    "criticalSuccess": {
      "description": "Outfit a troop with two upgrades, or 2 troops with the same upgrade"
    },
    "success": {
      "description": "Outfit troop"
    },
    "failure": {
      "description": "No gear"
    },
    "criticalFailure": {
      "description": "No gear"
    }
  },
  "failureCausesUnrest": false
}