{
  "id": "execute-or-pardon-prisoners",
  "name": "Execute or Pardon Prisoners",
  "category": "stability",
  "description": "Pass judgment on those who have threatened the kingdom's stability, choosing between mercy and justice.",
  "skills": [
    {
      "skill": "intimidation",
      "description": "harsh justice (execute)"
    },
    {
      "skill": "society",
      "description": "legal proceedings (execute)"
    },
    {
      "skill": "diplomacy",
      "description": "clemency (pardon)"
    },
    {
      "skill": "religion",
      "description": "divine forgiveness (pardon)"
    },
    {
      "skill": "performance",
      "description": "public ceremony (pardon)"
    }
  ],
  "effects": {
    "criticalSuccess": {
      "description": "Remove all imprisoned Unrest in the settlement and reduce Unrest by 1",
      "unrest": -1
    },
    "success": {
      "description": "Remove 1d4 imprisoned Unrest from the settlement"
    },
    "failure": {
      "description": "Remove none"
    },
    "criticalFailure": {
      "description": "Remove none; gain 1 current Unrest (riot, scandal, martyrdom)",
      "unrest": 1
    }
  },
  "failureCausesUnrest": true,
  "requirements": [
    {
      "type": "structure",
      "details": "Justice structure with imprisoned Unrest"
    }
  ]
}